{
  "$schema": "http://json-schema.org/draft-07/schema#",
  "$id": "claudius-client-config",
  "title": "Claudius Client Configuration",
  "type": "object",
  "required": ["name", "slug", "apiUrl", "allowedDomains"],
  "additionalProperties": false,
  "properties": {
    "$schema": {
      "type": "string"
    },
    "name": {
      "type": "string",
      "description": "Human-readable client name",
      "minLength": 1
    },
    "slug": {
      "type": "string",
      "description": "URL-safe identifier (lowercase alphanumeric and hyphens)",
      "pattern": "^[a-z0-9]+(?:-[a-z0-9]+)*$"
    },
    "apiUrl": {
      "type": "string",
      "description": "Full URL to the client's Claudius Worker chat endpoint",
      "format": "uri"
    },
    "allowedDomains": {
      "type": "array",
      "description": "Domains where this widget may be embedded",
      "items": { "type": "string" },
      "minItems": 1
    },
    "widget": {
      "type": "object",
      "additionalProperties": false,
      "properties": {
        "title": { "type": "string" },
        "subtitle": { "type": "string" },
        "welcomeMessage": { "type": "string" },
        "placeholder": { "type": "string" },
        "theme": { "type": "string", "enum": ["light", "dark", "auto"] },
        "position": {
          "type": "string",
          "enum": ["bottom-right", "bottom-left", "top-right", "top-left"]
        },
        "accentColor": { "type": "string", "pattern": "^#[0-9a-fA-F]{6}$" },
        "attachments": {
          "description": "Let visitors attach images and PDFs. true enables the defaults (5 MB, 5 files per message).",
          "oneOf": [
            { "type": "boolean" },
            {
              "type": "object",
              "additionalProperties": false,
              "properties": {
                "maxSizeBytes": { "type": "integer", "minimum": 1 },
                "maxCount": { "type": "integer", "minimum": 1 },
                "allowedTypes": {
                  "type": "array",
                  "items": { "type": "string" },
                  "minItems": 1
                }
              }
            }
          ]
        },
        "voice": {
          "description": "Voice input (mic button) and read-aloud via the browser's Web Speech API. true enables both with the defaults (click-to-toggle mic, no auto-submit).",
          "oneOf": [
            { "type": "boolean" },
            {
              "type": "object",
              "additionalProperties": false,
              "properties": {
                "input": { "type": "boolean" },
                "output": { "type": "boolean" },
                "mode": { "type": "string", "enum": ["toggle", "hold"] },
                "autoSubmit": { "type": "boolean" },
                "lang": { "type": "string", "minLength": 1 }
              }
            }
          ]
        },
        "conversationExport": {
          "type": "boolean",
          "description": "Let visitors copy the conversation as Markdown, or download it as Markdown or JSON, from a menu in the chat header. Off by default. Nothing is sent to the worker."
        },
        "citations": {
          "description": "Render [n] citations in grounded replies as chips with a footer of source cards, and ask the worker to number its excerpts. true enables the defaults (5 cards before Show all, favicons on). Off by default; needs RAG on the worker.",
          "oneOf": [
            { "type": "boolean" },
            {
              "type": "object",
              "additionalProperties": false,
              "properties": {
                "maxSources": { "type": "integer", "minimum": 1 },
                "favicons": { "type": "boolean" }
              }
            }
          ]
        }
      }
    },
    "worker": {
      "type": "object",
      "additionalProperties": false,
      "properties": {
        "model": { "type": "string" },
        "maxTokens": { "type": "integer", "minimum": 1, "maximum": 8192 },
        "rateLimitMinute": { "type": "integer", "minimum": 1 },
        "rateLimitHour": { "type": "integer", "minimum": 1 },
        "systemPrompt": {
          "type": "string",
          "description": "Relative path to a markdown file containing the system prompt"
        },
        "attachments": {
          "type": "object",
          "description": "Worker-side attachment settings; map to the ATTACHMENT_* variables",
          "additionalProperties": false,
          "properties": {
            "enabled": { "type": "boolean" },
            "maxBytes": { "type": "integer", "minimum": 1 },
            "maxCount": { "type": "integer", "minimum": 1 },
            "maxRequestBytes": { "type": "integer", "minimum": 1 },
            "allowedTypes": {
              "type": "array",
              "items": { "type": "string" },
              "minItems": 1
            },
            "storage": { "type": "string", "enum": ["passthrough", "r2"] },
            "retentionHours": { "type": "integer", "minimum": 1 },
            "quotaIpBytesPerDay": { "type": "integer", "minimum": 0 },
            "quotaTenantBytesPerDay": { "type": "integer", "minimum": 0 }
          }
        }
      }
    }
  }
}
